{"$schema":"https://json-schema.org/draft/2020-12/schema","$id":"https://github.com/bjoern-janson/ssi/research/ssi_calc/v0_1/schema.json","title":"SSI-CALC v0.1 benchmark case","type":"object","additionalProperties":false,"required":["spec_version","id","family","title","objects","facts","authority_edges","request","expected"],"properties":{"spec_version":{"const":"SSI-CALC-V0.1"},"id":{"type":"string","pattern":"^CASE-[0-9]{3}$"},"family":{"enum":["F1_ORACLE","F2_SUBSTITUTION","F3_COMPOSITION","F4_IDENTITY","F5_PROVENANCE","F6_REGIME","F7_TRANSPORT","F8_FUTURE"]},"title":{"type":"string","minLength":1},"description":{"type":"string"},"objects":{"type":"array","items":{"$ref":"#/$defs/object"}},"facts":{"type":"array","items":{"$ref":"#/$defs/fact"}},"authority_edges":{"type":"array","items":{"$ref":"#/$defs/authority_edge"}},"request":{"$ref":"#/$defs/request"},"expected":{"$ref":"#/$defs/expected"}},"$defs":{"object":{"type":"object","additionalProperties":false,"required":["id","type"],"properties":{"id":{"type":"string","minLength":1},"type":{"type":"string","minLength":1},"attributes":{"type":"object"}}},"fact":{"type":"object","additionalProperties":false,"required":["id","kind","args"],"properties":{"id":{"type":"string","minLength":1},"kind":{"type":"string","minLength":1},"args":{"type":"array","items":{"type":["string","number","boolean","null"]}},"jurisdiction":{"type":"string"},"provenance":{"type":"string"},"authority":{"enum":["CONSTITUTED","SCOPED","UNRESOLVED","WITHDRAWN","PROVENANCE_ONLY"]}}},"authority_edge":{"type":"object","additionalProperties":false,"required":["id","source","target","jurisdiction","provenance","evidence","scope","preconditions","preservation"],"properties":{"id":{"type":"string","minLength":1},"source":{"type":"string","minLength":1},"target":{"type":"string","minLength":1},"jurisdiction":{"type":"string","minLength":1},"provenance":{"type":"string","minLength":1},"evidence":{"type":"array","items":{"type":"string"}},"scope":{"type":"array","items":{"type":"string"}},"preconditions":{"type":"array","items":{"type":"string"}},"preservation":{"type":"array","items":{"type":"string"}}}},"request":{"type":"object","additionalProperties":false,"required":["operation","args","jurisdiction"],"properties":{"operation":{"type":"string","minLength":1},"args":{"type":"array","items":{"type":["string","number","boolean","null"]}},"jurisdiction":{"type":"string","minLength":1},"consumer":{"type":"string"},"requested_authority":{"type":"string"}}},"expected":{"type":"object","additionalProperties":false,"required":["status","failure_locus","preserved_facts","missing_authority","reopened","explanation"],"properties":{"status":{"enum":["AUTHORIZED","AUTHORIZED_SCOPED","NOT_IDENTIFIED","SEMANTIC_TYPE_ERROR","UNLICENSED_JURISDICTION_TRANSFER","UNLICENSED_TRANSPORT","CONGRUENCE_FAILURE","COMPOSITION_FAILURE","PROVENANCE_LEAK","REGIME_MISMATCH","JURISDICTIONAL_DIVERGENCE","FUTURE_UNSAFE","EXTERNAL_AUTHORITY_REQUIRED","REOPEN"]},"failure_locus":{"enum":["NONE","DECLARE","ADMIT","LICENSE","EQUIV","SUBSTITUTE","CONGRUENCE","TRANSPORT","QUOTIENT","COMPOSE","PRESERVE","TRANSFER","PROVENANCE","REOPEN"]},"preserved_facts":{"type":"array","items":{"type":"string"}},"missing_authority":{"type":"array","items":{"type":"string"}},"reopened":{"type":"array","items":{"type":"string"}},"explanation":{"type":"string","minLength":1}}}}}