{"spec_version":"SSI-CALC-V0.1","id":"CASE-019","family":"F3_COMPOSITION","title":"Two safe components form an unsafe joint input","objects":[{"id":"x","type":"Input"},{"id":"y","type":"Input"},{"id":"H","type":"Consumer"}],"facts":[{"id":"f1","kind":"locally_safe","args":["x"],"jurisdiction":"H","provenance":"component_audit","authority":"CONSTITUTED"},{"id":"f2","kind":"locally_safe","args":["y"],"jurisdiction":"H","provenance":"component_audit","authority":"CONSTITUTED"},{"id":"f3","kind":"joint_counterexample","args":["x","y"],"jurisdiction":"H","provenance":"hostile_witness","authority":"CONSTITUTED"}],"authority_edges":[{"id":"a1","source":"x","target":"H","jurisdiction":"H","provenance":"component_audit","evidence":["f1"],"scope":["single"],"preconditions":[],"preservation":[]},{"id":"a2","source":"y","target":"H","jurisdiction":"H","provenance":"component_audit","evidence":["f2"],"scope":["single"],"preconditions":[],"preservation":[]}],"request":{"operation":"compose_inputs","args":["x","y","H"],"jurisdiction":"H","consumer":"H"},"expected":{"status":"COMPOSITION_FAILURE","failure_locus":"COMPOSE","preserved_facts":["f1","f2","f3"],"missing_authority":[],"reopened":[],"explanation":"The hostile joint witness blocks composition while preserving both local safety facts."}}