{"spec_version":"SSI-CALC-V0.1","id":"CASE-055","family":"F7_TRANSPORT","title":"Common pullback domain licenses relation comparison","objects":[{"id":"S1","type":"Carrier"},{"id":"S2","type":"Carrier"},{"id":"C","type":"CommonDomain"},{"id":"p1","type":"Map"},{"id":"p2","type":"Map"}],"facts":[{"id":"f1","kind":"common_domain","args":["C","S1","S2"],"jurisdiction":"comparison","provenance":"comparison_contract","authority":"CONSTITUTED"},{"id":"f2","kind":"pullback_map","args":["p1","C","S1"],"jurisdiction":"comparison","provenance":"comparison_contract","authority":"CONSTITUTED"},{"id":"f3","kind":"pullback_map","args":["p2","C","S2"],"jurisdiction":"comparison","provenance":"comparison_contract","authority":"CONSTITUTED"},{"id":"f4","kind":"operation_alignment_verified","args":["p1","p2"],"jurisdiction":"comparison","provenance":"comparison_contract","authority":"CONSTITUTED"}],"authority_edges":[],"request":{"operation":"compare_relations","args":["p1","p2"],"jurisdiction":"comparison"},"expected":{"status":"AUTHORIZED_SCOPED","failure_locus":"NONE","preserved_facts":["f1","f2","f3","f4"],"missing_authority":[],"reopened":[],"explanation":"A constituted common domain and aligned operations provide a legitimate comparison surface."}}