{"spec_version":"SSI-CALC-V0.1","id":"CASE-046","family":"F6_REGIME","title":"Reopen conclusions after an external regime withdrawal condition fires","objects":[{"id":"r","type":"SemanticRegime"},{"id":"claim","type":"Claim"}],"facts":[{"id":"f1","kind":"claim_authorized_by","args":["claim","r"],"jurisdiction":"kappa","provenance":"prior_audit","authority":"SCOPED"},{"id":"f2","kind":"withdrawal_triggered","args":["r"],"jurisdiction":"regime_governance","provenance":"external_source","authority":"CONSTITUTED"}],"authority_edges":[],"request":{"operation":"reopen","args":["claim"],"jurisdiction":"kappa","consumer":"claim"},"expected":{"status":"REOPEN","failure_locus":"REOPEN","preserved_facts":["f2"],"missing_authority":[],"reopened":["claim_authorized","claim_not_authorized"],"explanation":"The regime withdrawal reopens downstream claims without erasing the historical fact that they were once scoped-authorized."}}