{"spec_version":"SSI-CALC-V0.1","id":"CASE-026","family":"F4_IDENTITY","title":"Behavioral equivalence is promoted to presentation identity","objects":[{"id":"q1","type":"PresentationState"},{"id":"q2","type":"PresentationState"}],"facts":[{"id":"f1","kind":"behavioral_equivalence","args":["q1","q2"],"jurisdiction":"finite_input_behavior","provenance":"moore_regime","authority":"CONSTITUTED"}],"authority_edges":[],"request":{"operation":"assert_identity","args":["q1","q2"],"jurisdiction":"presentation_identity"},"expected":{"status":"UNLICENSED_JURISDICTION_TRANSFER","failure_locus":"TRANSFER","preserved_facts":["f1"],"missing_authority":["behavior_to_presentation_identity_transfer"],"reopened":[],"explanation":"Behavioral sameness is not a rule for presentation identity."}}