{"spec_version":"SSI-CALC-V0.1","id":"CASE-032","family":"F4_IDENTITY","title":"Identity claim is made inside an admitted identity regime","objects":[{"id":"x","type":"EndpointPairValue"},{"id":"y","type":"EndpointPairValue"}],"facts":[{"id":"f1","kind":"same_extensional_denotation","args":["x","y"],"jurisdiction":"endpoint_pair_identity","provenance":"external_extensional_regime","authority":"CONSTITUTED"},{"id":"f2","kind":"identity_regime_admitted","args":["endpoint_pair_identity"],"jurisdiction":"endpoint_pair_identity","provenance":"admission_record","authority":"CONSTITUTED"}],"authority_edges":[],"request":{"operation":"assert_identity","args":["x","y"],"jurisdiction":"endpoint_pair_identity"},"expected":{"status":"AUTHORIZED_SCOPED","failure_locus":"NONE","preserved_facts":["f1","f2"],"missing_authority":[],"reopened":[],"explanation":"The identity claim stays within a separately admitted identity regime."}}