{"spec_version":"SSI-CALC-V0.1","id":"CASE-048","family":"F6_REGIME","title":"Different regime outputs are treated as disagreement before purpose comparability","objects":[{"id":"r1","type":"SemanticRegime"},{"id":"r2","type":"SemanticRegime"},{"id":"x","type":"Presentation"},{"id":"y","type":"Presentation"}],"facts":[{"id":"f1","kind":"equivalent_under","args":["r1","x","y"],"jurisdiction":"kappa1","provenance":"r1","authority":"CONSTITUTED"},{"id":"f2","kind":"different_under","args":["r2","x","y"],"jurisdiction":"kappa2","provenance":"r2","authority":"CONSTITUTED"}],"authority_edges":[],"request":{"operation":"assert_regime_disagreement","args":["r1","r2","x","y"],"jurisdiction":"comparison"},"expected":{"status":"JURISDICTIONAL_DIVERGENCE","failure_locus":"ADMIT","preserved_facts":["f1","f2"],"missing_authority":["purpose_compatibility(kappa1,kappa2)"],"reopened":[],"explanation":"Different purpose-indexed relations are not disagreement until their jurisdictions are comparable."}}