{"spec_version":"SSI-CALC-V0.1","id":"CASE-012","family":"F2_SUBSTITUTION","title":"Equivalence exists but consumer congruence is unresolved","objects":[{"id":"x","type":"SemanticValue"},{"id":"y","type":"SemanticValue"},{"id":"f","type":"Operation"}],"facts":[{"id":"f1","kind":"equivalent","args":["x","y"],"jurisdiction":"kappa","provenance":"regime_r","authority":"CONSTITUTED"},{"id":"f2","kind":"congruence_status","args":["f","kappa","unknown"],"jurisdiction":"kappa","provenance":"operation_contract","authority":"UNRESOLVED"}],"authority_edges":[],"request":{"operation":"apply_equivalent","args":["f","x","y"],"jurisdiction":"kappa","consumer":"f"},"expected":{"status":"NOT_IDENTIFIED","failure_locus":"CONGRUENCE","preserved_facts":["f1","f2"],"missing_authority":["congruence(f,kappa)"],"reopened":[],"explanation":"The relation is real but its substitutability under f is not identified."}}