{"spec_version":"SSI-CALC-V0.1","id":"CASE-007","family":"F1_ORACLE","title":"Ground truth calibrates a post-hoc threshold under an explicit calibration scope","objects":[{"id":"pred","type":"PredictionSet"},{"id":"delta","type":"GroundTruth"},{"id":"tau","type":"Threshold"}],"facts":[{"id":"f1","kind":"predictions_frozen","args":["pred"],"jurisdiction":"calibration","provenance":"run_log","authority":"CONSTITUTED"},{"id":"f2","kind":"ground_truth_available","args":["delta"],"jurisdiction":"calibration","provenance":"heldout_labels","authority":"SCOPED"}],"authority_edges":[{"id":"a1","source":"delta","target":"tau","jurisdiction":"calibration","provenance":"heldout_labels","evidence":["f1","f2"],"scope":["posthoc_threshold_only"],"preconditions":["predictions_frozen"],"preservation":["model_parameters_unchanged"]}],"request":{"operation":"calibrate","args":["pred","delta","tau"],"jurisdiction":"calibration","consumer":"tau"},"expected":{"status":"AUTHORIZED_SCOPED","failure_locus":"NONE","preserved_facts":["f1","f2"],"missing_authority":[],"reopened":[],"explanation":"The answer-bearing data is explicitly scoped to post-hoc calibration after predictions are frozen."}}