{"spec_version":"SSI-CALC-V0.1","id":"CASE-041","family":"F6_REGIME","title":"External regime is admitted for its declared jurisdiction","objects":[{"id":"r","type":"SemanticRegime"},{"id":"x","type":"Presentation"},{"id":"y","type":"Presentation"}],"facts":[{"id":"f1","kind":"regime_admitted","args":["r","kappa"],"jurisdiction":"kappa","provenance":"admission_record","authority":"CONSTITUTED"},{"id":"f2","kind":"equivalent_under","args":["r","x","y"],"jurisdiction":"kappa","provenance":"r","authority":"CONSTITUTED"}],"authority_edges":[],"request":{"operation":"assert_equivalence","args":["x","y"],"jurisdiction":"kappa"},"expected":{"status":"AUTHORIZED_SCOPED","failure_locus":"NONE","preserved_facts":["f1","f2"],"missing_authority":[],"reopened":[],"explanation":"The regime is used exactly within its admitted jurisdiction."}}