{"spec_version":"SSI-CALC-V0.1","id":"CASE-063","family":"F8_FUTURE","title":"Preserve every distinction forever without a future contract","objects":[{"id":"X","type":"StateSpace"}],"facts":[{"id":"f1","kind":"all_distinctions_available","args":["X"],"jurisdiction":"representation","provenance":"state_model","authority":"CONSTITUTED"}],"authority_edges":[],"request":{"operation":"mandate_permanent_preservation","args":["X"],"jurisdiction":"all_future"},"expected":{"status":"EXTERNAL_AUTHORITY_REQUIRED","failure_locus":"PRESERVE","preserved_facts":["f1"],"missing_authority":["future_relevance_contract"],"reopened":[],"explanation":"Availability of distinctions does not authorize preservation-maximalism."}}