{"spec_version":"SSI-CALC-V0.1","id":"CASE-064","family":"F8_FUTURE","title":"Present-score improvement destroys a required correction path","objects":[{"id":"f","type":"Transformation"},{"id":"S","type":"State"},{"id":"S2","type":"State"},{"id":"G","type":"CorrectionPath"}],"facts":[{"id":"f1","kind":"present_score_improves","args":["f","S","S2"],"jurisdiction":"present_objective","provenance":"evaluation","authority":"CONSTITUTED"},{"id":"f2","kind":"required_future_path","args":["G"],"jurisdiction":"future_contract","provenance":"future_spec","authority":"CONSTITUTED"},{"id":"f3","kind":"transformation_destroys","args":["f","G"],"jurisdiction":"future_contract","provenance":"reachability_witness","authority":"CONSTITUTED"}],"authority_edges":[],"request":{"operation":"authorize_transform","args":["f","S","S2"],"jurisdiction":"future_contract","consumer":"S2"},"expected":{"status":"FUTURE_UNSAFE","failure_locus":"PRESERVE","preserved_facts":["f1","f2","f3"],"missing_authority":[],"reopened":[],"explanation":"Present improvement cannot authorize a transformation that consumes a required future correction path."}}