{"spec_version":"SSI-CALC-V0.1","id":"CASE-006","family":"F1_ORACLE","title":"Reopen detector warrant after answer dependency is discovered","objects":[{"id":"H","type":"Detector"},{"id":"x","type":"Feature"},{"id":"delta","type":"GroundTruth"}],"facts":[{"id":"f1","kind":"previously_authorized_input","args":["x","H"],"jurisdiction":"detection","provenance":"prior_audit","authority":"SCOPED"},{"id":"f2","kind":"later_discovered_encodes","args":["x","delta"],"jurisdiction":"provenance_audit","provenance":"lineage_review","authority":"CONSTITUTED"}],"authority_edges":[],"request":{"operation":"reopen","args":["f1"],"jurisdiction":"detection","consumer":"H"},"expected":{"status":"REOPEN","failure_locus":"REOPEN","preserved_facts":["f2"],"missing_authority":[],"reopened":["previously_authorized_input(x,H)"],"explanation":"New lineage evidence invalidates the earlier detector-input warrant while preserving the new provenance fact."}}