{"spec_version":"SSI-CALC-V0.1","id":"CASE-017","family":"F3_COMPOSITION","title":"Two licensed transformations have an explicit composition certificate","objects":[{"id":"X","type":"State"},{"id":"Y","type":"State"},{"id":"Z","type":"State"}],"facts":[{"id":"f1","kind":"compose_compatible","args":["a1","a2"],"jurisdiction":"pipeline","provenance":"composition_contract","authority":"CONSTITUTED"}],"authority_edges":[{"id":"a1","source":"X","target":"Y","jurisdiction":"pipeline","provenance":"source_A","evidence":[],"scope":["step1"],"preconditions":[],"preservation":["G1"]},{"id":"a2","source":"Y","target":"Z","jurisdiction":"pipeline","provenance":"source_B","evidence":[],"scope":["step2"],"preconditions":[],"preservation":["G2"]}],"request":{"operation":"compose","args":["a1","a2"],"jurisdiction":"pipeline","consumer":"Z"},"expected":{"status":"AUTHORIZED","failure_locus":"NONE","preserved_facts":["f1"],"missing_authority":[],"reopened":[],"explanation":"Both edges are licensed and the composition compatibility is explicit."}}