{"spec_version":"SSI-CALC-V0.1","id":"CASE-049","family":"F7_TRANSPORT","title":"Two regimes already share the same comparison carrier","objects":[{"id":"x","type":"CommonCarrier"},{"id":"y","type":"CommonCarrier"},{"id":"r1","type":"SemanticRegime"},{"id":"r2","type":"SemanticRegime"}],"facts":[{"id":"f1","kind":"shared_carrier","args":["r1","r2","CommonCarrier"],"jurisdiction":"comparison","provenance":"comparison_contract","authority":"CONSTITUTED"},{"id":"f2","kind":"purpose_compatible","args":["r1","r2"],"jurisdiction":"comparison","provenance":"comparison_contract","authority":"CONSTITUTED"}],"authority_edges":[],"request":{"operation":"compare_relations","args":["r1","r2","x","y"],"jurisdiction":"comparison"},"expected":{"status":"AUTHORIZED_SCOPED","failure_locus":"NONE","preserved_facts":["f1","f2"],"missing_authority":[],"reopened":[],"explanation":"No transport is needed when the common carrier and purpose alignment are already constituted."}}