{"spec_version":"SSI-CALC-V0.1","id":"CASE-039","family":"F5_PROVENANCE","title":"Model agreement is counted as independent evidence","objects":[{"id":"m1","type":"Model"},{"id":"m2","type":"Model"},{"id":"claim","type":"Claim"}],"facts":[{"id":"f1","kind":"same_training_source","args":["m1","m2"],"jurisdiction":"provenance","provenance":"model_cards","authority":"CONSTITUTED"},{"id":"f2","kind":"agree","args":["m1","m2","claim"],"jurisdiction":"prediction","provenance":"outputs","authority":"CONSTITUTED"}],"authority_edges":[],"request":{"operation":"assert_independent_evidence","args":["m1","m2","claim"],"jurisdiction":"evidence_independence"},"expected":{"status":"PROVENANCE_LEAK","failure_locus":"PROVENANCE","preserved_facts":["f1","f2"],"missing_authority":["independence_bridge"],"reopened":[],"explanation":"Agreement from shared provenance does not automatically create independent evidence."}}