{"spec_version":"SSI-CALC-V0.1","id":"CASE-018","family":"F3_COMPOSITION","title":"Individually licensed transformations lack composition authority","objects":[{"id":"X","type":"State"},{"id":"Y","type":"State"},{"id":"Z","type":"State"}],"facts":[],"authority_edges":[{"id":"a1","source":"X","target":"Y","jurisdiction":"pipeline","provenance":"source_A","evidence":[],"scope":["step1"],"preconditions":[],"preservation":[]},{"id":"a2","source":"Y","target":"Z","jurisdiction":"pipeline","provenance":"source_B","evidence":[],"scope":["step2"],"preconditions":[],"preservation":[]}],"request":{"operation":"compose","args":["a1","a2"],"jurisdiction":"pipeline","consumer":"Z"},"expected":{"status":"COMPOSITION_FAILURE","failure_locus":"COMPOSE","preserved_facts":[],"missing_authority":["composition_certificate(a1,a2)"],"reopened":[],"explanation":"Individual licenses do not imply license for their composition."}}