{"spec_version":"SSI-CALC-V0.1","id":"CASE-023","family":"F3_COMPOSITION","title":"Composition intermediate types do not match","objects":[{"id":"X","type":"TypeA"},{"id":"Y","type":"TypeB"},{"id":"Y2","type":"TypeD"},{"id":"Z","type":"TypeC"}],"facts":[{"id":"f1","kind":"output_contract","args":["a1","TypeB"],"jurisdiction":"pipeline","provenance":"schema","authority":"CONSTITUTED"},{"id":"f2","kind":"input_contract","args":["a2","TypeD"],"jurisdiction":"pipeline","provenance":"schema","authority":"CONSTITUTED"}],"authority_edges":[{"id":"a1","source":"X","target":"Y","jurisdiction":"pipeline","provenance":"schema","evidence":["f1"],"scope":["typed"],"preconditions":[],"preservation":[]},{"id":"a2","source":"Y2","target":"Z","jurisdiction":"pipeline","provenance":"schema","evidence":["f2"],"scope":["typed"],"preconditions":[],"preservation":[]}],"request":{"operation":"compose","args":["a1","a2"],"jurisdiction":"pipeline","consumer":"Z"},"expected":{"status":"SEMANTIC_TYPE_ERROR","failure_locus":"DECLARE","preserved_facts":["f1","f2"],"missing_authority":["matching_intermediate_type"],"reopened":[],"explanation":"The shallowest failure is type closure before composition authority is considered."}}