{"spec_version":"SSI-CALC-V0.1","id":"CASE-043","family":"F6_REGIME","title":"Comparison requests a regime that was never admitted","objects":[{"id":"r1","type":"SemanticRegime"},{"id":"r2","type":"SemanticRegime"}],"facts":[{"id":"f1","kind":"regime_admitted","args":["r1","kappa"],"jurisdiction":"kappa","provenance":"admission_record","authority":"CONSTITUTED"}],"authority_edges":[],"request":{"operation":"compare_regimes","args":["r1","r2"],"jurisdiction":"kappa"},"expected":{"status":"REGIME_MISMATCH","failure_locus":"ADMIT","preserved_facts":["f1"],"missing_authority":["admission(r2,kappa)"],"reopened":[],"explanation":"Regime admissibility precedes comparison."}}