{"spec_version":"SSI-CALC-V0.1","id":"CASE-002","family":"F1_ORACLE","title":"Ground truth is fed directly into the detector","objects":[{"id":"H","type":"Detector"},{"id":"delta","type":"GroundTruth"}],"facts":[{"id":"f1","kind":"ground_truth_available","args":["delta"],"jurisdiction":"evaluation","provenance":"external_evaluator","authority":"SCOPED"}],"authority_edges":[],"request":{"operation":"inform","args":["delta","H"],"jurisdiction":"detection","consumer":"H","requested_authority":"detection_authority"},"expected":{"status":"UNLICENSED_JURISDICTION_TRANSFER","failure_locus":"TRANSFER","preserved_facts":["f1"],"missing_authority":["evaluation_to_detection_transfer"],"reopened":[],"explanation":"Availability for grading does not authorize use as a detector input."}}