{"spec_version":"SSI-CALC-V0.1","id":"CASE-022","family":"F3_COMPOSITION","title":"Reopen a composite after a hidden interaction is discovered","objects":[{"id":"X","type":"State"},{"id":"Z","type":"State"}],"facts":[{"id":"f1","kind":"prior_composite_authorized","args":["c1"],"jurisdiction":"pipeline","provenance":"prior_audit","authority":"SCOPED"},{"id":"f2","kind":"hidden_interaction_counterexample","args":["c1"],"jurisdiction":"pipeline","provenance":"new_hostile_test","authority":"CONSTITUTED"}],"authority_edges":[],"request":{"operation":"reopen","args":["c1"],"jurisdiction":"pipeline","consumer":"Z"},"expected":{"status":"REOPEN","failure_locus":"REOPEN","preserved_facts":["f2"],"missing_authority":[],"reopened":["composite_authority(c1)"],"explanation":"The newly discovered interaction invalidates the composite warrant, not unrelated upstream facts."}}