{"spec_version":"SSI-CALC-V0.1","id":"CASE-020","family":"F3_COMPOSITION","title":"Typed composition preserves the intermediate contract","objects":[{"id":"X","type":"TypeA"},{"id":"Y","type":"TypeB"},{"id":"Z","type":"TypeC"}],"facts":[{"id":"f1","kind":"output_contract","args":["a1","TypeB"],"jurisdiction":"pipeline","provenance":"schema","authority":"CONSTITUTED"},{"id":"f2","kind":"input_contract","args":["a2","TypeB"],"jurisdiction":"pipeline","provenance":"schema","authority":"CONSTITUTED"},{"id":"f3","kind":"compose_compatible","args":["a1","a2"],"jurisdiction":"pipeline","provenance":"schema","authority":"CONSTITUTED"}],"authority_edges":[{"id":"a1","source":"X","target":"Y","jurisdiction":"pipeline","provenance":"schema","evidence":["f1"],"scope":["typed"],"preconditions":[],"preservation":["TypeB"]},{"id":"a2","source":"Y","target":"Z","jurisdiction":"pipeline","provenance":"schema","evidence":["f2"],"scope":["typed"],"preconditions":["TypeB"],"preservation":["TypeC"]}],"request":{"operation":"compose","args":["a1","a2"],"jurisdiction":"pipeline","consumer":"Z"},"expected":{"status":"AUTHORIZED_SCOPED","failure_locus":"NONE","preserved_facts":["f1","f2","f3"],"missing_authority":[],"reopened":[],"explanation":"Intermediate typing and composition compatibility align."}}