{"spec_version":"SSI-CALC-V0.1","id":"CASE-036","family":"F5_PROVENANCE","title":"External provenance record includes an explicit semantic bridge","objects":[{"id":"dataset","type":"EvidenceSource"},{"id":"claim","type":"Claim"}],"facts":[{"id":"f1","kind":"source_attribution","args":["dataset","lab_A"],"jurisdiction":"provenance","provenance":"signed_manifest","authority":"CONSTITUTED"},{"id":"f2","kind":"semantic_bridge","args":["dataset","claim"],"jurisdiction":"measurement_scope","provenance":"measurement_contract","authority":"CONSTITUTED"}],"authority_edges":[{"id":"a1","source":"dataset","target":"claim","jurisdiction":"measurement_scope","provenance":"measurement_contract","evidence":["f1","f2"],"scope":["claim_support"],"preconditions":[],"preservation":[]}],"request":{"operation":"support","args":["dataset","claim"],"jurisdiction":"measurement_scope","consumer":"claim"},"expected":{"status":"AUTHORIZED_SCOPED","failure_locus":"NONE","preserved_facts":["f1","f2"],"missing_authority":[],"reopened":[],"explanation":"The semantic use is authorized by a separate bridge, not by provenance alone."}}