{"spec_version":"SSI-CALC-V0.1","id":"CASE-050","family":"F7_TRANSPORT","title":"Injective carrier embedding and commuting operations authorize transport","objects":[{"id":"S1","type":"Carrier"},{"id":"Sstar","type":"Carrier"},{"id":"tau","type":"Transport"}],"facts":[{"id":"f1","kind":"injective","args":["tau"],"jurisdiction":"comparison","provenance":"alignment_contract","authority":"CONSTITUTED"},{"id":"f2","kind":"maps_carrier","args":["tau","S1","Sstar"],"jurisdiction":"comparison","provenance":"alignment_contract","authority":"CONSTITUTED"},{"id":"f3","kind":"operations_commute","args":["tau"],"jurisdiction":"comparison","provenance":"alignment_contract","authority":"CONSTITUTED"},{"id":"f4","kind":"target_independent","args":["tau"],"jurisdiction":"comparison","provenance":"alignment_audit","authority":"CONSTITUTED"}],"authority_edges":[],"request":{"operation":"transport_relation","args":["tau"],"jurisdiction":"comparison"},"expected":{"status":"AUTHORIZED","failure_locus":"NONE","preserved_facts":["f1","f2","f3","f4"],"missing_authority":[],"reopened":[],"explanation":"The transport contract preserves relation well-formedness and operation meaning."}}