{"spec_version":"SSI-CALC-V0.1","id":"CASE-040","family":"F5_PROVENANCE","title":"Augmentation multiplicity is counted as independent observations","objects":[{"id":"x","type":"Observation"},{"id":"aug1","type":"Augmentation"},{"id":"aug2","type":"Augmentation"}],"facts":[{"id":"f1","kind":"derived_from","args":["aug1","x"],"jurisdiction":"provenance","provenance":"augmentation_log","authority":"CONSTITUTED"},{"id":"f2","kind":"derived_from","args":["aug2","x"],"jurisdiction":"provenance","provenance":"augmentation_log","authority":"CONSTITUTED"}],"authority_edges":[],"request":{"operation":"count_independent_observations","args":["aug1","aug2"],"jurisdiction":"evidence_independence"},"expected":{"status":"PROVENANCE_LEAK","failure_locus":"PROVENANCE","preserved_facts":["f1","f2"],"missing_authority":["augmentation_to_independence_bridge"],"reopened":[],"explanation":"Multiplicity of derived views does not establish independent observation count."}}